{
  "schemaVersion": "v0",
  "capability": "evidence.pack",
  "service": "evidence-service",
  "packId": "epk-run-2-0002",
  "runId": "run-2",
  "workflowId": "w0-migration-v0",
  "wave": "w0",
  "status": "complete",
  "summary": "W0 reference run for CTRLDEC01",
  "createdAt": "2026-05-14T11:18:17.162732Z",
  "createdBy": "w0-reference-run",
  "artifacts": {
    "sourceCobol": [
      {
        "uri": "urn:c2c/cobol/CTRLDEC01",
        "sha256": "c61683c95fc180d8a74a0a5fe8dc2460f7b4b029b49942d0f55ba234b3c562fe",
        "byteSize": 939,
        "mimeType": "text/x-cobol",
        "kind": "evidence-input"
      }
    ],
    "semanticIr": {
      "uri": "urn:c2c/semantic-ir/CTRLDEC01/run-2",
      "sha256": "db06a532cd6b50cc91e85ba010c11e13edeccc38c38eda17d5789e2522f34505",
      "byteSize": 13520,
      "mimeType": "application/json",
      "kind": "evidence-input"
    },
    "generatedJava": {
      "uri": "urn:c2c/generated-java/CTRLDEC01/run-2",
      "sha256": "419c607868c442c81fc43bc3a650eea62b40a25e26cbe95159074f0a46cb92df",
      "byteSize": 10008,
      "mimeType": "application/json",
      "kind": "evidence-input"
    },
    "runtimeVersion": {
      "id": "c2c-target-java-runtime:v0"
    },
    "modelInvocations": [
      {
        "invocationId": "inv-run-2-noop",
        "modelId": "none",
        "provider": "observation-only",
        "status": "skipped",
        "ledgerRef": {
          "uri": "urn:c2c/model-invocations/run-2",
          "sha256": "86ef8c9184a8d2494b443992c3bf5640c03512af791555a552583ff6ee0e38ef",
          "byteSize": 170,
          "mimeType": "application/json",
          "kind": "evidence-input"
        }
      }
    ],
    "buildTestResults": [
      {
        "uri": "urn:c2c/build-test/CTRLDEC01/run-2",
        "sha256": "eaee3ec1dbe8afb3bd780c43b59d85388b31a5a49502209fb78b5e479b58d024",
        "byteSize": 2005,
        "mimeType": "application/json",
        "kind": "evidence-input"
      }
    ],
    "harnessEvents": {
      "uri": "urn:c2c/harness-events/run-2",
      "sha256": "47428a7c3b681fad5e698e7dbd8895ae0925983772f10c5b47ef0a8208c9198a",
      "byteSize": 16616,
      "mimeType": "application/json",
      "kind": "evidence-input"
    },
    "trajectoryLedger": {
      "uri": "urn:c2c/trajectory-ledger/run-2",
      "sha256": "ab695ada3f1bb48dc176d6ddefd08ece835386689829280e84a0f24a0cce541b",
      "byteSize": 4519,
      "mimeType": "application/json",
      "kind": "evidence-input"
    }
  },
  "openAssumptions": [
    {
      "id": "mixed-golden-master-provenance",
      "description": "BRNCH01 is reproduced through GnuCOBOL cobcrun; CTRLDEC01 and BATCH01 remain synthetic Golden Master fixtures."
    }
  ],
  "validation": {
    "ok": true,
    "requiredArtifacts": [
      "sourceCobol",
      "semanticIr",
      "generatedJava",
      "buildTestResults",
      "harnessEvents",
      "modelInvocations"
    ],
    "missingArtifacts": []
  },
  "exports": [
    {
      "format": "directory",
      "uri": "urn:c2c/evidence-export/epk-run-2-0002",
      "sha256": "2b66f41c24d713ee0af2f69905080db8c9c95c38faa6f16d1d02ee0a79c3f4df",
      "byteSize": 2936,
      "createdAt": "2026-05-14T11:18:17.195624Z"
    }
  ]
}
