{
  "schemaVersion": "v0",
  "capability": "evidence.pack",
  "service": "evidence-service",
  "packId": "epk-run-3-0003",
  "runId": "run-3",
  "workflowId": "w0-migration-v0",
  "wave": "w0",
  "status": "complete",
  "summary": "W0 reference run for BATCH01",
  "createdAt": "2026-05-14T11:18:17.571819Z",
  "createdBy": "w0-reference-run",
  "artifacts": {
    "sourceCobol": [
      {
        "uri": "urn:c2c/cobol/BATCH01",
        "sha256": "0120d6c79d0e2c78014106fab7e10de8936b01471e87de94c9337bfdf9fe5a08",
        "byteSize": 847,
        "mimeType": "text/x-cobol",
        "kind": "evidence-input"
      }
    ],
    "semanticIr": {
      "uri": "urn:c2c/semantic-ir/BATCH01/run-3",
      "sha256": "23ea94440cdf2b8ca2112d47e4004948ba8f152f2ed60c1d24f428bce9785906",
      "byteSize": 12012,
      "mimeType": "application/json",
      "kind": "evidence-input"
    },
    "generatedJava": {
      "uri": "urn:c2c/generated-java/BATCH01/run-3",
      "sha256": "28a001d5769636dfff196ed4d9da0f02744556f8bb40410141fa41529082d3cd",
      "byteSize": 9692,
      "mimeType": "application/json",
      "kind": "evidence-input"
    },
    "runtimeVersion": {
      "id": "c2c-target-java-runtime:v0"
    },
    "modelInvocations": [
      {
        "invocationId": "inv-run-3-noop",
        "modelId": "none",
        "provider": "observation-only",
        "status": "skipped",
        "ledgerRef": {
          "uri": "urn:c2c/model-invocations/run-3",
          "sha256": "6973c4722cf8fec0abab644ba272a30c43d07236f02f37e56b1980f65f4e5220",
          "byteSize": 170,
          "mimeType": "application/json",
          "kind": "evidence-input"
        }
      }
    ],
    "buildTestResults": [
      {
        "uri": "urn:c2c/build-test/BATCH01/run-3",
        "sha256": "5d47ea4d588acab3b3a3394f48d81d99121c479c31ab72357672d5c3d1204190",
        "byteSize": 2181,
        "mimeType": "application/json",
        "kind": "evidence-input"
      }
    ],
    "harnessEvents": {
      "uri": "urn:c2c/harness-events/run-3",
      "sha256": "90cb19bf03d1a16728c75685e9dce04c2349bde5afbbd365b744aefe326d9afc",
      "byteSize": 23312,
      "mimeType": "application/json",
      "kind": "evidence-input"
    },
    "trajectoryLedger": {
      "uri": "urn:c2c/trajectory-ledger/run-3",
      "sha256": "4fbf857e16324b5d887b2ffc9dc9843077c4a83ee7f44d1a4c3cecd4cfe381a0",
      "byteSize": 4522,
      "mimeType": "application/json",
      "kind": "evidence-input"
    }
  },
  "openAssumptions": [
    {
      "id": "mixed-golden-master-provenance",
      "description": "BRNCH01 is reproduced through GnuCOBOL cobcrun; CTRLDEC01 and BATCH01 remain synthetic Golden Master fixtures."
    }
  ],
  "validation": {
    "ok": true,
    "requiredArtifacts": [
      "sourceCobol",
      "semanticIr",
      "generatedJava",
      "buildTestResults",
      "harnessEvents",
      "modelInvocations"
    ],
    "missingArtifacts": []
  },
  "exports": [
    {
      "format": "directory",
      "uri": "urn:c2c/evidence-export/epk-run-3-0003",
      "sha256": "15cf6c02869509cafe4693918cbe268b9835c1faaa3cc3a24b8ea8239f76d365",
      "byteSize": 2925,
      "createdAt": "2026-05-14T11:18:17.604025Z"
    }
  ]
}
