{
  "schemaVersion": "v0",
  "capability": "evidence.pack",
  "service": "evidence-service",
  "packId": "epk-run-3-0003",
  "runId": "run-3",
  "workflowId": "w0-migration-v0",
  "wave": "w0",
  "status": "complete",
  "summary": "W0 demo run for BATCH01",
  "createdAt": "2026-05-14T10:46:17.063074Z",
  "createdBy": "w0-demo",
  "artifacts": {
    "sourceCobol": [
      {
        "uri": "urn:c2c/cobol/BATCH01",
        "sha256": "0120d6c79d0e2c78014106fab7e10de8936b01471e87de94c9337bfdf9fe5a08",
        "byteSize": 847,
        "mimeType": "text/x-cobol",
        "kind": "evidence-input"
      }
    ],
    "semanticIr": {
      "uri": "urn:c2c/semantic-ir/BATCH01/run-3",
      "sha256": "5a4001f41ebe5d602c8498674d5bb2c5d5ce34511f4a8302e00d43d5eff3108c",
      "byteSize": 10605,
      "mimeType": "application/json",
      "kind": "evidence-input"
    },
    "generatedJava": {
      "uri": "urn:c2c/generated-java/BATCH01/run-3",
      "sha256": "518ef69ee9d5749f54be953d670dff83a3626caee476249f46c09b2f7b8242fc",
      "byteSize": 10224,
      "mimeType": "application/json",
      "kind": "evidence-input"
    },
    "runtimeVersion": {
      "id": "c2c-target-java-runtime:v0"
    },
    "modelInvocations": [
      {
        "invocationId": "inv-run-3-noop",
        "modelId": "none",
        "provider": "observation-only",
        "status": "skipped",
        "ledgerRef": {
          "uri": "urn:c2c/model-invocations/run-3",
          "sha256": "6973c4722cf8fec0abab644ba272a30c43d07236f02f37e56b1980f65f4e5220",
          "byteSize": 170,
          "mimeType": "application/json",
          "kind": "evidence-input"
        }
      }
    ],
    "buildTestResults": [
      {
        "uri": "urn:c2c/build-test/BATCH01/run-3",
        "sha256": "df0db2d6be82d5951e44ca53c4a6d75483de1e064161131e1cba658a0124b1f8",
        "byteSize": 2281,
        "mimeType": "application/json",
        "kind": "evidence-input"
      }
    ],
    "harnessEvents": {
      "uri": "urn:c2c/harness-events/run-3",
      "sha256": "232274d14a4f8fecd808bcdbdccaea43c6c3756bd8334ec4715de45fa9ea7662",
      "byteSize": 27132,
      "mimeType": "application/json",
      "kind": "evidence-input"
    },
    "trajectoryLedger": {
      "uri": "urn:c2c/trajectory-ledger/run-3",
      "sha256": "1989688070fffe84324d83511f3379071a786ad482f79df8f9d8a9ada8a6b1e4",
      "byteSize": 5370,
      "mimeType": "application/json",
      "kind": "evidence-input"
    }
  },
  "openAssumptions": [
    {
      "id": "w0-coverage-gap",
      "description": "W0 generator does not yet translate PERFORM/EVALUATE/IF/ADD/COMPUTE; divergence is expected and documented per program."
    }
  ],
  "validation": {
    "ok": true,
    "requiredArtifacts": [
      "sourceCobol",
      "semanticIr",
      "generatedJava",
      "buildTestResults",
      "harnessEvents",
      "modelInvocations"
    ],
    "missingArtifacts": []
  },
  "exports": [
    {
      "format": "directory",
      "uri": "urn:c2c/evidence-export/epk-run-3-0003",
      "sha256": "f6b0a8735491b96ed73623355c97cce3c46a19a1563d60e7632139bec4bfa707",
      "byteSize": 2916,
      "createdAt": "2026-05-14T10:46:17.092938Z"
    }
  ]
}
