{
  "schemaVersion": "v0",
  "capability": "evidence.pack",
  "service": "evidence-service",
  "packId": "epk-run-1-0001",
  "runId": "run-1",
  "workflowId": "w0-migration-v0",
  "wave": "w0",
  "status": "complete",
  "summary": "W0 reference run for BRNCH01",
  "createdAt": "2026-05-14T11:18:16.739495Z",
  "createdBy": "w0-reference-run",
  "artifacts": {
    "sourceCobol": [
      {
        "uri": "urn:c2c/cobol/BRNCH01",
        "sha256": "3d7315ada91339e8a119a7eef4cb564e2dde114c5d21fc34866b7acefeaf7602",
        "byteSize": 1333,
        "mimeType": "text/x-cobol",
        "kind": "evidence-input"
      }
    ],
    "semanticIr": {
      "uri": "urn:c2c/semantic-ir/BRNCH01/run-1",
      "sha256": "c4a080240ca48e0a1ae45ed1bbc19511e1967b151663863201f2ca706be2f59f",
      "byteSize": 23689,
      "mimeType": "application/json",
      "kind": "evidence-input"
    },
    "generatedJava": {
      "uri": "urn:c2c/generated-java/BRNCH01/run-1",
      "sha256": "fc231bf080c72a9cc3c8dab5fbf07ea76ecfae77a9f3261c2e2043c497f5fb47",
      "byteSize": 12372,
      "mimeType": "application/json",
      "kind": "evidence-input"
    },
    "runtimeVersion": {
      "id": "c2c-target-java-runtime:v0"
    },
    "modelInvocations": [
      {
        "invocationId": "inv-run-1-noop",
        "modelId": "none",
        "provider": "observation-only",
        "status": "skipped",
        "ledgerRef": {
          "uri": "urn:c2c/model-invocations/run-1",
          "sha256": "cbdb006fb249f9bcd9c134cbcf7188c4bdb08314fe27da2200f74b049a8d5c01",
          "byteSize": 170,
          "mimeType": "application/json",
          "kind": "evidence-input"
        }
      }
    ],
    "buildTestResults": [
      {
        "uri": "urn:c2c/build-test/BRNCH01/run-1",
        "sha256": "a0bc4c017959aa356178f89264754f44c8ce6d4724a2fe38783583015d38d236",
        "byteSize": 2727,
        "mimeType": "application/json",
        "kind": "evidence-input"
      }
    ],
    "harnessEvents": {
      "uri": "urn:c2c/harness-events/run-1",
      "sha256": "c3f645ef3a35131f578d9265c3415cfbf2d7a90a569f8fc0373a1c69188bdb25",
      "byteSize": 9906,
      "mimeType": "application/json",
      "kind": "evidence-input"
    },
    "trajectoryLedger": {
      "uri": "urn:c2c/trajectory-ledger/run-1",
      "sha256": "8ecae855679a6afe8ebb49edff14d27a792406af3f8cb8b267b65126c22c032c",
      "byteSize": 5709,
      "mimeType": "application/json",
      "kind": "evidence-input"
    }
  },
  "openAssumptions": [
    {
      "id": "mixed-golden-master-provenance",
      "description": "BRNCH01 is reproduced through GnuCOBOL cobcrun; CTRLDEC01 and BATCH01 remain synthetic Golden Master fixtures."
    }
  ],
  "validation": {
    "ok": true,
    "requiredArtifacts": [
      "sourceCobol",
      "semanticIr",
      "generatedJava",
      "buildTestResults",
      "harnessEvents",
      "modelInvocations"
    ],
    "missingArtifacts": []
  },
  "exports": [
    {
      "format": "directory",
      "uri": "urn:c2c/evidence-export/epk-run-1-0001",
      "sha256": "48ea61bdb2c69bb32b0e59583988fd9fffef84cfe3b918269b45fb2cfcfb2a5d",
      "byteSize": 2926,
      "createdAt": "2026-05-14T11:18:16.773477Z"
    }
  ]
}
